{
  "all_passed": true,
  "authority": "L3",
  "case_id": "P7-IMMEDIATELY-SEPARABLE-001",
  "certificate_hash": "b0687e9bece7e8ae6077c3c17be7bd3e85803f706f86ce6e3a4434d487660560",
  "certificate_id": "FC-8b39b6b84dbfc69ab2b7",
  "obligations": {
    "authority": true,
    "counterfactual_stability": true,
    "evidence_integrity": true,
    "executable_scope": true,
    "hypothesis_separation": true,
    "interaction_safety": true,
    "kernel_preservation": true,
    "replay": true,
    "risk_justification": true,
    "witness_sufficiency": true
  },
  "parent_hash": "0943f81d9912ed78b0c7d25ab4ba238f72657f8f8c50212bd440795ac236fb60",
  "surviving_hypotheses": [
    "approved-fast-loop-P7-IMMEDIATELY-SEPARABLE-001"
  ],
  "terminal_action": "REJECT",
  "witness_ids": [
    "terminal_witness"
  ]
}
