{
  "all_passed": true,
  "authority": "L3",
  "case_id": "P7-IMMEDIATELY-SEPARABLE-005",
  "certificate_hash": "510f459b3010a2a21acc67fb801c300e3f289e200d8da97d7b85d61f9e64f408",
  "certificate_id": "FC-b9cb1cf1e60ecbdd1b87",
  "obligations": {
    "authority": true,
    "counterfactual_stability": true,
    "evidence_integrity": true,
    "executable_scope": true,
    "hypothesis_separation": true,
    "interaction_safety": true,
    "kernel_preservation": true,
    "replay": true,
    "risk_justification": true,
    "witness_sufficiency": true
  },
  "parent_hash": "54d9ea61b6fcb202eef816c34974d768c61da65131e843a53b9aea5ca1201acc",
  "surviving_hypotheses": [
    "approved-fast-loop-P7-IMMEDIATELY-SEPARABLE-005"
  ],
  "terminal_action": "REJECT",
  "witness_ids": [
    "terminal_witness"
  ]
}
