{
  "all_passed": true,
  "authority": "L2",
  "case_id": "P7-GENUINELY-NEW-SEMANTIC-NEED-006",
  "certificate_hash": "15062dc7c19e07d5b0e52458050205c593864aeb4511670565c7191fb94b888e",
  "certificate_id": "LC-3468856419662440f8f7",
  "obligations": {
    "authority": true,
    "counterfactual_stability": true,
    "evidence_integrity": true,
    "executable_scope": true,
    "hypothesis_separation": true,
    "interaction_safety": true,
    "kernel_preservation": true,
    "replay": true,
    "risk_justification": true,
    "witness_sufficiency": true
  },
  "parent_hash": "aa0deee36ed634488423f36abeb520a5a7a06f5e66e6d77493010861e4212840",
  "surviving_hypotheses": [
    "P7-GENUINELY-NEW-SEMANTIC-NEED-006-SAFE"
  ],
  "terminal_action": "ACCEPT",
  "witness_ids": [
    "terminal_witness"
  ]
}
