{
  "all_passed": true,
  "authority": "L2",
  "case_id": "P7-SCOPE-NEIGHBOR-007",
  "certificate_hash": "8b7af6f094708a900a28e2c735a060efff35c928dcaea016f3e5790967dc1b67",
  "certificate_id": "LC-645883ebd1a19069af57",
  "obligations": {
    "authority": true,
    "counterfactual_stability": true,
    "evidence_integrity": true,
    "executable_scope": true,
    "hypothesis_separation": true,
    "interaction_safety": true,
    "kernel_preservation": true,
    "replay": true,
    "risk_justification": true,
    "witness_sufficiency": true
  },
  "parent_hash": "48c75647c1debece7016206c544c184bc1da41bb0f654bd77457d35e3aca4ff8",
  "surviving_hypotheses": [
    "P7-SCOPE-NEIGHBOR-007-UNSAFE"
  ],
  "terminal_action": "REJECT",
  "witness_ids": [
    "terminal_witness"
  ]
}
