{
  "all_passed": true,
  "authority": "L2",
  "case_id": "P7-MASKED-SAFE-EVIDENCE-006",
  "certificate_hash": "3108d1106e7ca4721413a3215a738ddc90abe0e3caf1bcebf24a017919521168",
  "certificate_id": "LC-f86effe26199077b28c1",
  "obligations": {
    "authority": true,
    "counterfactual_stability": true,
    "evidence_integrity": true,
    "executable_scope": true,
    "hypothesis_separation": true,
    "interaction_safety": true,
    "kernel_preservation": true,
    "replay": true,
    "risk_justification": true,
    "witness_sufficiency": true
  },
  "parent_hash": "81b607db29186439700089b6c730bfec222c7b791f5f30a406b7ccdad3b88571",
  "surviving_hypotheses": [
    "P7-MASKED-SAFE-EVIDENCE-006-SAFE"
  ],
  "terminal_action": "ACCEPT",
  "witness_ids": [
    "terminal_witness"
  ]
}
