{
  "all_passed": true,
  "authority": "L2",
  "case_id": "P7-GENUINELY-NEW-SEMANTIC-NEED-005",
  "certificate_hash": "33c76cb21fff746f7120d780c25ca34ee7553960c7faca85ba918e1336c25cfc",
  "certificate_id": "LC-91dfbf4e2ca577f8f3e5",
  "obligations": {
    "authority": true,
    "counterfactual_stability": true,
    "evidence_integrity": true,
    "executable_scope": true,
    "hypothesis_separation": true,
    "interaction_safety": true,
    "kernel_preservation": true,
    "replay": true,
    "risk_justification": true,
    "witness_sufficiency": true
  },
  "parent_hash": "4f8a050f20a79bce536aff700b47b81bfd564506ffa5bf364b0e44b4de038970",
  "surviving_hypotheses": [
    "P7-GENUINELY-NEW-SEMANTIC-NEED-005-UNSAFE"
  ],
  "terminal_action": "REJECT",
  "witness_ids": [
    "terminal_witness"
  ]
}
